{
  "schemaVersion": "https://open4goods.org/schema/o4g-registry-1.json",
  "registryVersion": 4,
  "classes": [
    {
      "id": "o4g:class:television",
      "lifecycle": "ACTIVE",
      "labels": {
        "en": "Television",
        "fr": "Téléviseur"
      },
      "parent": null,
      "attributes": [
        "o4g:attribute:width",
        "o4g:attribute:color"
      ],
      "mappings": [
        {
          "system": "icecat",
          "externalId": "category:1584",
          "status": "REVIEWED",
          "effectiveFrom": "2026-09-11",
          "effectiveTo": null
        },
        {
          "system": "eprel",
          "externalId": "group:televisions",
          "status": "REVIEWED",
          "effectiveFrom": "2026-09-11",
          "effectiveTo": null
        },
        {
          "system": "eprel",
          "externalId": "group:electronicdisplays",
          "status": "REVIEWED",
          "effectiveFrom": "2026-09-11",
          "effectiveTo": null
        },
        {
          "system": "etim",
          "externalId": "class:EC001764",
          "status": "REVIEWED",
          "effectiveFrom": "2026-09-11",
          "effectiveTo": null
        },
        {
          "system": "wikidata",
          "externalId": "Q26899",
          "status": "REVIEWED",
          "effectiveFrom": "2026-09-11",
          "effectiveTo": null
        }
      ]
    },
    {
      "id": "o4g:class:dishwasher",
      "lifecycle": "ACTIVE",
      "labels": {
        "en": "Dishwasher",
        "fr": "Lave-vaisselle"
      },
      "parent": null,
      "attributes": [
        "o4g:attribute:width",
        "o4g:attribute:color"
      ],
      "mappings": [
        {
          "system": "eprel",
          "externalId": "group:dishwashers",
          "status": "REVIEWED",
          "effectiveFrom": "2026-09-11",
          "effectiveTo": null
        },
        {
          "system": "eprel",
          "externalId": "group:dishwashers2019",
          "status": "REVIEWED",
          "effectiveFrom": "2026-09-11",
          "effectiveTo": null
        },
        {
          "system": "etim",
          "externalId": "class:EC000780",
          "status": "REVIEWED",
          "effectiveFrom": "2026-09-11",
          "effectiveTo": null
        },
        {
          "system": "wikidata",
          "externalId": "Q58009",
          "status": "REVIEWED",
          "effectiveFrom": "2026-09-11",
          "effectiveTo": null
        }
      ]
    },
    {
      "id": "o4g:class:air-conditioner",
      "lifecycle": "ACTIVE",
      "labels": {
        "en": "Air conditioner",
        "fr": "Climatiseur"
      },
      "parent": null,
      "attributes": [
        "o4g:attribute:width",
        "o4g:attribute:color"
      ],
      "mappings": [
        {
          "system": "icecat",
          "externalId": "category:224",
          "status": "REVIEWED",
          "effectiveFrom": "2026-09-11",
          "effectiveTo": null
        },
        {
          "system": "eprel",
          "externalId": "group:airconditioners",
          "status": "REVIEWED",
          "effectiveFrom": "2026-09-11",
          "effectiveTo": null
        },
        {
          "system": "etim",
          "externalId": "class:EC011604",
          "status": "REVIEWED",
          "effectiveFrom": "2026-09-11",
          "effectiveTo": null
        },
        {
          "system": "etim",
          "externalId": "class:EC011573",
          "status": "REVIEWED",
          "effectiveFrom": "2026-09-11",
          "effectiveTo": null
        },
        {
          "system": "etim",
          "externalId": "class:EC011579",
          "status": "REVIEWED",
          "effectiveFrom": "2026-09-11",
          "effectiveTo": null
        },
        {
          "system": "wikidata",
          "externalId": "Q1265533",
          "status": "REVIEWED",
          "effectiveFrom": "2026-09-11",
          "effectiveTo": null
        }
      ]
    },
    {
      "id": "o4g:class:oven",
      "lifecycle": "ACTIVE",
      "labels": {
        "en": "Oven",
        "fr": "Four"
      },
      "parent": null,
      "attributes": [
        "o4g:attribute:width",
        "o4g:attribute:color"
      ],
      "mappings": [
        {
          "system": "icecat",
          "externalId": "category:2286",
          "status": "REVIEWED",
          "effectiveFrom": "2026-09-11",
          "effectiveTo": null
        },
        {
          "system": "eprel",
          "externalId": "group:ovens",
          "status": "REVIEWED",
          "effectiveFrom": "2026-09-11",
          "effectiveTo": null
        },
        {
          "system": "etim",
          "externalId": "class:EC001843",
          "status": "REVIEWED",
          "effectiveFrom": "2026-09-11",
          "effectiveTo": null
        },
        {
          "system": "wikidata",
          "externalId": "Q36539",
          "status": "REVIEWED",
          "effectiveFrom": "2026-09-11",
          "effectiveTo": null
        }
      ]
    },
    {
      "id": "o4g:class:refrigerator",
      "lifecycle": "ACTIVE",
      "labels": {
        "en": "Refrigerator",
        "fr": "Réfrigérateur"
      },
      "parent": null,
      "attributes": [
        "o4g:attribute:width",
        "o4g:attribute:color"
      ],
      "mappings": [
        {
          "system": "eprel",
          "externalId": "group:refrigeratingappliances",
          "status": "REVIEWED",
          "effectiveFrom": "2026-09-11",
          "effectiveTo": null
        },
        {
          "system": "eprel",
          "externalId": "group:refrigeratingappliances2019",
          "status": "REVIEWED",
          "effectiveFrom": "2026-09-11",
          "effectiveTo": null
        },
        {
          "system": "eprel",
          "externalId": "group:professionalrefrigeratedstoragecabinets",
          "status": "REVIEWED",
          "effectiveFrom": "2026-09-11",
          "effectiveTo": null
        },
        {
          "system": "etim",
          "externalId": "class:EC000438",
          "status": "REVIEWED",
          "effectiveFrom": "2026-09-11",
          "effectiveTo": null
        },
        {
          "system": "etim",
          "externalId": "class:EC000440",
          "status": "REVIEWED",
          "effectiveFrom": "2026-09-11",
          "effectiveTo": null
        },
        {
          "system": "wikidata",
          "externalId": "Q3751369",
          "status": "REVIEWED",
          "effectiveFrom": "2026-09-11",
          "effectiveTo": null
        }
      ]
    },
    {
      "id": "o4g:class:smartphone",
      "lifecycle": "ACTIVE",
      "labels": {
        "en": "Smartphone",
        "fr": "Smartphone"
      },
      "parent": null,
      "attributes": [
        "o4g:attribute:width",
        "o4g:attribute:color"
      ],
      "mappings": [
        {
          "system": "etim",
          "externalId": "class:EC002268",
          "status": "REVIEWED",
          "effectiveFrom": "2026-09-11",
          "effectiveTo": null
        },
        {
          "system": "wikidata",
          "externalId": "Q22645",
          "status": "REVIEWED",
          "effectiveFrom": "2026-09-11",
          "effectiveTo": null
        }
      ]
    },
    {
      "id": "o4g:class:washing-machine",
      "lifecycle": "ACTIVE",
      "labels": {
        "en": "Washing machine",
        "fr": "Lave-linge"
      },
      "parent": null,
      "attributes": [
        "o4g:attribute:width",
        "o4g:attribute:color"
      ],
      "mappings": [
        {
          "system": "eprel",
          "externalId": "group:washingmachines",
          "status": "REVIEWED",
          "effectiveFrom": "2026-09-11",
          "effectiveTo": null
        },
        {
          "system": "eprel",
          "externalId": "group:washingmachines2019",
          "status": "REVIEWED",
          "effectiveFrom": "2026-09-11",
          "effectiveTo": null
        },
        {
          "system": "eprel",
          "externalId": "group:washerdriers",
          "status": "REVIEWED",
          "effectiveFrom": "2026-09-11",
          "effectiveTo": null
        },
        {
          "system": "eprel",
          "externalId": "group:washerdriers2019",
          "status": "REVIEWED",
          "effectiveFrom": "2026-09-11",
          "effectiveTo": null
        },
        {
          "system": "etim",
          "externalId": "class:EC000021",
          "status": "REVIEWED",
          "effectiveFrom": "2026-09-11",
          "effectiveTo": null
        },
        {
          "system": "wikidata",
          "externalId": "Q127917",
          "status": "REVIEWED",
          "effectiveFrom": "2026-09-11",
          "effectiveTo": null
        }
      ]
    }
  ],
  "attributes": [
    {
      "id": "o4g:attribute:width",
      "lifecycle": "ACTIVE",
      "labels": {
        "en": "Width",
        "fr": "Largeur"
      },
      "valueType": "QUANTITY",
      "cardinality": "SINGLE",
      "dimension": "LENGTH",
      "canonicalUnit": "cm",
      "constraints": {
        "minimum": 0,
        "maximum": 1000,
        "allowedCodes": []
      },
      "mappings": [
        {
          "system": "icecat",
          "externalId": "feature:1649",
          "status": "REVIEWED",
          "effectiveFrom": "2026-09-11",
          "effectiveTo": null
        },
        {
          "system": "icecat",
          "externalId": "feature:4157",
          "status": "REVIEWED",
          "effectiveFrom": "2026-09-11",
          "effectiveTo": null
        }
      ],
      "resolutionPolicy": "o4g:resolution-policy:product-dimensions@1"
    },
    {
      "id": "o4g:attribute:color",
      "lifecycle": "ACTIVE",
      "labels": {
        "en": "Color",
        "fr": "Couleur"
      },
      "valueType": "LOCALIZED_TEXT",
      "cardinality": "MULTIPLE",
      "dimension": null,
      "canonicalUnit": null,
      "constraints": {
        "minimum": null,
        "maximum": null,